{
  "schema_version": "tobac.m2-pathway.v1",
  "review_date": "2026-10-27",
  "contrast": "Prospective NZ national cap of 600 smoked-tobacco retailers versus unchanged availability; first full year after implementation; not an implemented treatment.",
  "protocol": "docs/m2_retail_contract.md",
  "input_sha256": {
    "docs/m2_retail_contract.md": "f00f25aa7dbb91daac8574e9e79a24c90b8be87c6be61aba6523010d1f59c6fc",
    "docs/MOH_OBSERVATION_PATHWAY.md": "a75887dd078461cdb9b2e3d7c7ee5fb91ce44d676683e841d134ee72a044dc2d",
    "evidence/m2/source_review.json": "42941c8fcd2aebfe7d17c429ffb41bcd6ebd4aa8960b1e61f8c6297c625d292f",
    "data/longitudinal_20261024/nz_tobacco_release_tonnes_2010_2025.csv": "ef85faa4e338f499bf15a5bed85ffdf139c839a54ea1d7c682d79f350256232e",
    "integration/archive/moh-workbook-qualification_20261026.json": "b26f31443677e90f156cfae6953a05f4fd9a18245b33ba665c33e6f2519985f6"
  },
  "sources": [
    {
      "id": "MOH_REGIME_20261027",
      "url": "https://www.health.govt.nz/regulation-legislation/smoked-tobacco",
      "locator": "Smoked tobacco regulatory regime",
      "review": "Rendered primary page states approved retailer scheme repealed. The historical 600-outlet proposal is retained in source_review.json; no prospective commencement or authority verified.",
      "raw_capture": "not_obtained"
    },
    {
      "id": "MOH_RETURNS_2025",
      "url": "https://www.health.govt.nz/regulation-legislation/smoked-tobacco/information-for-manufacturers-and-importers/tobacco-returns/tobacco-returns-2025",
      "locator": "Highlights; tonnes chart; annual returns",
      "review": "Calendar-2025 national retail releases; heated tobacco reported separately, tonnes chart excludes cigars/cigarillos. Previously verified workbook retains 755 tonnes; not resident lawful consumption. Product/channel reconciliation remains open.",
      "raw_capture": "retained_prior_verified_workbook"
    },
    {
      "id": "NZHS_202425",
      "url": "https://www.health.govt.nz/monitoring-statistics/surveys/new-zealand-health-survey/publications/202425-survey-publications/trends-in-smoking-and-vaping",
      "locator": "Things to consider; Total population",
      "review": "Daily smoking prevalence 6.8% for people aged 15+; collection described as July2024 to July2025. Exact endpoint days are not asserted. Snapshot cannot identify cause/effect or total consumption volume.",
      "raw_capture": "not_obtained"
    }
  ],
  "observations": [
    {
      "observation_id": "NZHS_daily_smoking_202425",
      "cell": "unassigned",
      "quantity": "prevalence",
      "scope": null,
      "products": [],
      "data_ids": [
        "NZHS:2024-25:smoking"
      ],
      "role": "observation",
      "source_id": "NZHS_202425"
    },
    {
      "observation_id": "MOH_releases_2025",
      "cell": "unassigned",
      "quantity": "releases",
      "scope": {
        "geography": "NZ_national",
        "population": "national retail release market; not resident consumers",
        "start": "2025-01-01",
        "end": "2026-01-01",
        "unit": "tonnes/year"
      },
      "products": [
        "reported_smoked_tobacco_excluding_cigars_cigarillos_other_coverage_unresolved"
      ],
      "data_ids": [
        "NZ_MOH_tobacco_returns:2025-01-01/2026-01-01"
      ],
      "role": "observation",
      "source_id": "MOH_RETURNS_2025"
    }
  ],
  "research_gaps": [
    "Prospective legal authority, commencement and contemporary outlet/catchment roster not obtained",
    "Actual matched total/lawful treated/comparator before/after observations not obtained",
    "Factory-made counts/RYO mass, intensity and biological-yield conversions unqualified",
    "Stock, visitor, duty-free, wastage, reporting bias and shared measurement covariance unqualified",
    "Causal counterfactual, source transport, mitigation/replacement and held-out prediction unqualified",
    "Near-limit raw-scale assay, incremental criminal harms and real costs unqualified",
    "Maori governance, permissible use and equity constraints unresolved"
  ]
}
